{
  "template_version": "1.0",
  "template_id": "PRODUCT-QUICK-REMIX-15S",
  "display_name": "产品 15 秒快速混剪占位模板",
  "revision": 1,
  "status": "draft",
  "product_scope": ["*"],
  "match": {
    "platforms": ["抖音", "视频号", "小红书"],
    "aspect_ratios": ["9:16"],
    "languages": ["zh-CN"],
    "duration_seconds": 15,
    "tags": ["quick-remix", "product"]
  },
  "max_outputs": 20,
  "max_asset_uses": 1,
  "shots": [
    {
      "slot_id": "S01",
      "line_slot": "hook",
      "role": "hook",
      "duration_seconds": 5,
      "required_categories": ["product_hero"],
      "required_tags": ["product"],
      "preferred_tags": ["portable"],
      "allowed_media_types": ["image", "video"],
      "required_orientation": "any",
      "preferred_orientation": "portrait",
      "fit_mode": "contain",
      "allow_generic": false
    },
    {
      "slot_id": "S02",
      "line_slot": "feature",
      "role": "feature",
      "duration_seconds": 5,
      "required_categories": ["feature_proof"],
      "required_tags": ["approved-feature"],
      "preferred_tags": [],
      "allowed_media_types": ["image", "video"],
      "required_orientation": "any",
      "preferred_orientation": "portrait",
      "fit_mode": "cover_blur_background",
      "allow_generic": false
    },
    {
      "slot_id": "S03",
      "line_slot": "cta",
      "role": "cta",
      "duration_seconds": 5,
      "required_categories": ["usage_scene"],
      "required_tags": ["approved-scene"],
      "preferred_tags": ["lifestyle"],
      "allowed_media_types": ["image", "video"],
      "required_orientation": "any",
      "preferred_orientation": "portrait",
      "fit_mode": "cover",
      "allow_generic": false
    }
  ],
  "variants": [
    {"variant_id": "ABC", "name": "产品—功能—场景", "shot_order": ["S01", "S02", "S03"]},
    {"variant_id": "ACB", "name": "产品—场景—功能", "shot_order": ["S01", "S03", "S02"]}
  ],
  "notes": "占位示例；复制到 COMPANY_VIDEO_TEMPLATE_ROOTS 后，完成业务审核并将 status 改为 approved 才会参与自动选择。"
}
